{
  "schemaVersion": "1",
  "toolVersion": "0.4.0",
  "kind": "latest-run",
  "updatedAt": "2026-08-04T22:54:00.911Z",
  "artifactKind": "page-audit",
  "runId": "20260804T225355Z-041e25",
  "target": "http://127.0.0.1:4193/fixed",
  "state": "passed",
  "score": 100,
  "artifacts": {
    "html": "20260804T225355Z-041e25/report.html",
    "json": "20260804T225355Z-041e25/report.json",
    "repairPlanJson": "20260804T225355Z-041e25/repair-plan.json",
    "repairPlanMarkdown": "20260804T225355Z-041e25/repair-plan.md",
    "integrityManifest": "20260804T225355Z-041e25/evidence-manifest.json"
  }
}
