{
  "schemaVersion": "1",
  "toolVersion": "0.4.0",
  "kind": "latest-run",
  "updatedAt": "2026-08-04T16:35:52.929Z",
  "artifactKind": "page-audit",
  "runId": "20260804T163538Z-d26d37",
  "target": "http://127.0.0.1:4182/examples/accessibility-lab/broken.html",
  "state": "failed",
  "score": 69,
  "artifacts": {
    "html": "20260804T163538Z-d26d37/report.html",
    "json": "20260804T163538Z-d26d37/report.json",
    "repairPlanJson": "20260804T163538Z-d26d37/repair-plan.json",
    "repairPlanMarkdown": "20260804T163538Z-d26d37/repair-plan.md",
    "integrityManifest": "20260804T163538Z-d26d37/evidence-manifest.json"
  }
}
