{
  "schemaVersion": "1",
  "toolVersion": "0.4.0",
  "kind": "latest-run",
  "updatedAt": "2026-08-04T20:58:54.200Z",
  "artifactKind": "page-audit",
  "runId": "20260804T205848Z-25ccf3",
  "target": "http://127.0.0.1:4182/examples/privacy-lab/broken.html",
  "state": "failed",
  "score": 76,
  "artifacts": {
    "html": "20260804T205848Z-25ccf3/report.html",
    "json": "20260804T205848Z-25ccf3/report.json",
    "repairPlanJson": "20260804T205848Z-25ccf3/repair-plan.json",
    "repairPlanMarkdown": "20260804T205848Z-25ccf3/repair-plan.md",
    "integrityManifest": "20260804T205848Z-25ccf3/evidence-manifest.json"
  }
}
