{
  "schemaVersion": "1",
  "toolVersion": "0.4.0",
  "kind": "latest-run",
  "updatedAt": "2026-08-04T17:47:58.779Z",
  "artifactKind": "page-audit",
  "runId": "20260804T174746Z-c5865b",
  "target": "http://127.0.0.1:4182/examples/journey-lab/broken.html",
  "state": "failed",
  "score": 96,
  "artifacts": {
    "html": "20260804T174746Z-c5865b/report.html",
    "json": "20260804T174746Z-c5865b/report.json",
    "repairPlanJson": "20260804T174746Z-c5865b/repair-plan.json",
    "repairPlanMarkdown": "20260804T174746Z-c5865b/repair-plan.md",
    "integrityManifest": "20260804T174746Z-c5865b/evidence-manifest.json"
  }
}
