{
  "schemaVersion": "1",
  "toolVersion": "0.4.0",
  "kind": "latest-run",
  "updatedAt": "2026-08-04T16:35:52.931Z",
  "artifactKind": "page-audit",
  "runId": "20260804T163538Z-b0b154",
  "target": "http://127.0.0.1:4182/examples/security-lab/index.html",
  "state": "failed",
  "score": 84,
  "artifacts": {
    "html": "20260804T163538Z-b0b154/report.html",
    "json": "20260804T163538Z-b0b154/report.json",
    "repairPlanJson": "20260804T163538Z-b0b154/repair-plan.json",
    "repairPlanMarkdown": "20260804T163538Z-b0b154/repair-plan.md",
    "integrityManifest": "20260804T163538Z-b0b154/evidence-manifest.json"
  }
}
