{
  "schemaVersion": "1",
  "toolVersion": "0.4.0",
  "kind": "latest-run",
  "updatedAt": "2026-08-04T19:23:58.580Z",
  "artifactKind": "page-audit",
  "runId": "20260804T192344Z-7e2cb7",
  "target": "http://127.0.0.1:4182/examples/viewport-lab/broken.html",
  "state": "failed",
  "score": 92,
  "artifacts": {
    "html": "20260804T192344Z-7e2cb7/report.html",
    "json": "20260804T192344Z-7e2cb7/report.json",
    "repairPlanJson": "20260804T192344Z-7e2cb7/repair-plan.json",
    "repairPlanMarkdown": "20260804T192344Z-7e2cb7/repair-plan.md",
    "integrityManifest": "20260804T192344Z-7e2cb7/evidence-manifest.json"
  }
}
